{"cadence":"protected-main","generation":18,"previous_digest":"7fa2f7eb13be70d3667280fb26a346f66c9c47139e55cad7f9c6d2f661620324","recorded_at":"2026-08-27T21:49:15Z","resolution_digest":null,"result_digest":"1ad4539c8406733d611dc4e13db19076d3d4591e707c5778c12edb5714c0a214","retention_digest":"c8b71ede54e4feb288cfa7d10e9040136fa32adce9348eb39a04fe08dfe2a083","schema_version":1,"sha":"ef1aa446ed203fe6ba58821e6b8aa02722f1f5e8","status":"green"}
