{"cadence":"protected-main","generation":75,"previous_digest":"53161abdaa4f1ff37127b59385e9afc59e38a1cbbdc276d7e88eeb8adbb2cc63","recorded_at":"2026-09-14T10:51:36Z","resolution_digest":null,"result_digest":"1e67cd525984055effb93ee78336dfae1c56fe11f6998fb31dc23e6fb8fd10ac","retention_digest":"00fd838dabb000cc7f9f38055e0f2bebf59bfb8667d89303c1e9df363d76c998","schema_version":1,"sha":"afc9626ca78440a90875748d32ea0a1733b398f4","status":"green"}
