{"cadence":"repair-resolution","generation":15,"previous_digest":"a4457ecda1e191852a8e216e6033dd4a46da142c7dd8ef3e8fd18abd2c7a2563","recorded_at":"2026-08-27T17:17:03Z","resolution_digest":"8d03ef7410ed498a701e7698f0987fbb7b8b54684cf1d1c97f6a88b94f93db31","result_digest":"9c149b3c8861e96e2b36334752a8f8de4d5c2d6d9b74564e84897908e282d9ef","retention_digest":"be691e4003d9e7babe91ea6cfdaf25e35813ffe1b776ded2c263cdec896e775f","schema_version":1,"sha":"46a6c586ad4814089d39452ee4711c4c1b93d013","status":"green"}
