{"cadence":"protected-main","generation":65,"previous_digest":"d255fdead4ccf872611034634f86d0a0830fb13c24b3ebb20d33d23a218fc290","recorded_at":"2026-09-12T10:20:01Z","resolution_digest":null,"result_digest":"e0a81abe056cd8b2bb0b594b62ceb3c2eef4e3c439443f34993821868076a4b6","retention_digest":"b6bb550d8daf9f09abb768143aebe4cfefe8f9c4f9f89381e1e6dd7b2de530e7","schema_version":1,"sha":"67a2cde3b38dae5c8228624062de1f8eff78173b","status":"green"}
