{"cadence":"protected-main","generation":104,"previous_digest":"e03cf974c75b4c32a608c142785b54600495840271acde59e347e2ce35f530aa","recorded_at":"2026-09-22T18:08:43Z","resolution_digest":null,"result_digest":"83d328dba3f4f70b29e07cb06ea924cc1e8fd06fca1575549953fa259413ad0e","retention_digest":"ab19153524a26a59bdd07536debf67a13983e35b972cd0ae1cf0ef901bfaeb63","schema_version":1,"sha":"ef6b5db3d65d917c187ab5ffe1a234a316bc0893","status":"red"}
