{"cadence":"protected-main","generation":69,"previous_digest":"939487c9f16f03a31a26174c26797ab65a28df7a0264004893d4c0f2634bd42e","recorded_at":"2026-09-13T18:07:57Z","resolution_digest":null,"result_digest":"3f1bf157a171c4ae526fc5c935306e23b8f284605cb0002c7a8832ea818ae2e2","retention_digest":"b179a4ce30eda8544758df24180839798fcd0853edae58fbd098dc3cd8f594a2","schema_version":1,"sha":"3fd763816c9493475083adcd1299d2eed0daa0b2","status":"red"}
