{"cadence":"nightly","generation":46,"previous_digest":"4cfed43ee379ea581f8636f0e3943015a14df26d56175c62d8f372291aae3d8a","recorded_at":"2026-09-09T08:31:24Z","resolution_digest":null,"result_digest":"e1040a7285d26e0e9235a1af95058b34adb573ab778f0b5e4642c36490080a38","retention_digest":"97369aebe2a5f975a83fdbd6e7154df99a1711a24186f81abb8801e35264999d","schema_version":1,"sha":"cead75a5567cac31bcad57eda32a3895bb708e8b","status":"green"}
