{"cadence":"nightly","generation":103,"previous_digest":"be2d33e51046fd124e947c60c496c72164a379eaf03eb9ca21536073e8ced9a2","recorded_at":"2026-09-22T09:39:40Z","resolution_digest":null,"result_digest":"bfd55aabf05b926897089dd2220b71e28ed46e19a41027a29a5d8576742f8588","retention_digest":"3f7a19ff6dfc40684683747e99d333b7fce5e33d16c1ae6d9f9af315a104e254","schema_version":1,"sha":"07e390cadc0de4dab3988546a7cce269a7a30469","status":"red"}
