{"cadence":"nightly","generation":26,"previous_digest":"d8f58a74504ed362e22b188c753762b32afa244fb139fd15595a77d5458b8cc5","recorded_at":"2026-09-01T08:51:03Z","resolution_digest":null,"result_digest":"c644efa08ba7c195811810fe4f7d5249a50a2d3164df45767e4c2bb2c4d56975","retention_digest":"4246cc87bf93c7aaae24fcbdab16abcbf53f16aeda4912e28dae5230cc5442f9","schema_version":1,"sha":"2dd482762bdc612eb25925f9952020ed62ae5fbd","status":"green"}
