{"cadence":"nightly","generation":10,"previous_digest":"38dd2d2da9a14a1a1899c76ede4f73210d4908b6fb2a1899d159c5252178f8f4","recorded_at":"2026-08-27T09:42:47Z","resolution_digest":null,"result_digest":"d1a5cec1d6746c43efeaaa8542f7462068486514a48df5047d9efd3fc84ead82","retention_digest":"8de81796a793e2f7fa8eb0d73f513492e7896fb9fb5a4159c17558654acd06b2","schema_version":1,"sha":"0644a5dbd7fcdf4f9447b995a2baa5df17af8f75","status":"red"}
