{"cadence":"protected-main","generation":90,"previous_digest":"42e1314171cfe64f2c0e5a2ce29549bff2ca930e7e3219b5c950d16d78eeaf23","recorded_at":"2026-09-19T23:35:50Z","resolution_digest":null,"result_digest":"b2541469aaf938f427ce5af5650a9164ea865539c8acfae989c88679f366f1b4","retention_digest":"fb31bee88875dfb8c522f882bde8e92719ab1f0e7b5a812c697777def7accae5","schema_version":1,"sha":"28b8777c30d59e7d1084dc47ed84b3cf192dff89","status":"red"}
