{"cadence":"protected-main","generation":57,"previous_digest":"54c81e6f66f522533884b5b38fbcedf69790a32705a4e855bffec1270ce39e63","recorded_at":"2026-09-11T05:30:57Z","resolution_digest":null,"result_digest":"53038e25b22286b58464fbc78e53587053976422438ad5d3b47f99f532e26d98","retention_digest":"276f99a5094bb01bd08adbc8f00f1ad794f1bfc5850fe644f33fedc420f20454","schema_version":1,"sha":"0c61c73463f2016033927bf185d861e452faa8e0","status":"green"}
