{"cadence":"protected-main","generation":67,"previous_digest":"823242e6c93b1b875a5eafe8218d7e7ac9984294ea8f0c103b79662773034cb5","recorded_at":"2026-09-12T21:00:58Z","resolution_digest":null,"result_digest":"27c532c71cae8dff3922d2092e6dd9b7e59fd555cb403f1e08e980c66f6aeb08","retention_digest":"0db2577684f229fdb88d13881ed9426c5c4bdc5334bf11fe75d65861c1cb0991","schema_version":1,"sha":"5d6df8e6db0054d990623d042143e75e6b91ebce","status":"green"}
