{"cadence":"protected-main","generation":50,"previous_digest":"849124e65bc699ee4fac47f74047447c2a4405d7bb2eac0efa6c7519e822b4f0","recorded_at":"2026-09-10T02:29:30Z","resolution_digest":null,"result_digest":"1693b4f2fe4bca7b65ea88f98d0f4db412bc11fe5e609a79c8034255300c2f1f","retention_digest":"4915b99f8db89656e652c8ce99b87fd68a56d12140851b9a51cc805c7123146f","schema_version":1,"sha":"3e9a5f22de3fbdc97d1c11664a2ea96868e21489","status":"green"}
