{"cadence":"protected-main","generation":98,"previous_digest":"8730bd8e8e9bf08ee59a5d714bf0c64b3580a3672bcc70219a4e88f67d9ac534","recorded_at":"2026-09-21T02:50:41Z","resolution_digest":null,"result_digest":"5a9afa2bfcf647a3ded30ea185b66c6b6108ef0f085a75a2db538f043f8b9b17","retention_digest":"ed19cec281a77fdccd6c86fa12e56c4e4945fc90bdff6bac4bb6beff75c51909","schema_version":1,"sha":"d855014ad0de0803ef0b5e02b1d2561f870dd4cc","status":"green"}
