{"cadence":"protected-main","generation":27,"previous_digest":"9465c9fdb25e4178037f6b4bbb76f36803715dae5468f8cacae12172e190080d","recorded_at":"2026-09-02T08:26:39Z","resolution_digest":null,"result_digest":"0ff36e20760f5a30334d3a1726aa75ce2bd7212bff6ca483b253f085351c60b1","retention_digest":"bc27b9069cbdf2c7beee40fe25a4b50f1083cb87361692f01598347c7827f083","schema_version":1,"sha":"de18989b171b8224e909c37fbb421ec0a26d4349","status":"green"}
