{"cadence":"weekly","generation":9,"previous_digest":"694f3c22cbabef83ad5b69ec6bb872dd5ed64696cbf3f4c4403f1e4925818123","recorded_at":"2026-08-27T09:42:47Z","resolution_digest":null,"result_digest":"ce360e504a32c3e37b03bbdb9bbaeeb57a08f2534313397bef5c2de9f2573bff","retention_digest":"42a37dbe77c595762cb9575db49c9a5a568169dc0114561404c354c4570c667e","schema_version":1,"sha":"0644a5dbd7fcdf4f9447b995a2baa5df17af8f75","status":"red"}
