{"cadence":"protected-main","generation":56,"previous_digest":"e9a3fbfa8dcbf411c9dff053b19fe06870e2f3bf48c8c27423866fb25ae1ef11","recorded_at":"2026-09-11T01:45:34Z","resolution_digest":null,"result_digest":"33e34162335034398f85ec28c9d65e1a88e5c78526c501c3a19e3bc849eebfac","retention_digest":"a285c5a2cb2dd1d1b4f1c435d0ac0a8f73025254959f4671d5c5e864e6db1162","schema_version":1,"sha":"f9cebd91b4c4cf3dca5d762d7d51cd5855043ac8","status":"green"}
