{"cadence":"protected-main","generation":89,"previous_digest":"4a75c7bc4cdc2deb7798021a15e1cb8125cdfe6dd4eb8c5e2b54338a4e959173","recorded_at":"2026-09-19T19:37:07Z","resolution_digest":null,"result_digest":"d3391bce0f40f2429f51a38d9ee147f5986475d1eb1278ba75dd0356011a4c68","retention_digest":"98b5f9641f127e0f530677a5f7dec9f3bff9a8a3a90f81b2b30f728c39e8dae6","schema_version":1,"sha":"2505cfc6c1cbbc3e7e6695de13d4420a567ac2fc","status":"red"}
