{"cadence":"protected-main","generation":32,"previous_digest":"86d71c2b03f1dce22e50ee95cc425474e9511597ac2d4de3798f7e8894a1ec6f","recorded_at":"2026-09-03T20:14:19Z","resolution_digest":null,"result_digest":"e4c1a68043a4d1cdab3c6ae11a761a8152ede4533c3e18a26b4a334d9267df62","retention_digest":"0f8259d8c6277ee9077ff89164b0de18073965cef78a2db267611e2168f29cfa","schema_version":1,"sha":"225690dc76b820e99bac2235cb3513d6f1a7e430","status":"green"}
