{"cadence":"protected-main","generation":4,"previous_digest":"2695c74d4cd9f9a95d373b8929b22372ded55b8250f039ff95ae91331032bb44","recorded_at":"2026-08-25T20:06:01Z","resolution_digest":null,"result_digest":"9ba6352c9ef52662ac1dff37acfce0a144131dd049bf086f0812fcdf39ba1b70","retention_digest":"1071f1902f81ab7323950a5d180044a03e55104050cd7dda3f3164e3d934eac0","schema_version":1,"sha":"ada55cf2521cca32e061d1bf54736830f7050efb","status":"green"}
