{"cadence":"protected-main","generation":108,"previous_digest":"f7f507c860ff6ff36fe7986143ede4840ccc26d948d288eae81bd6dbb80dce07","recorded_at":"2026-09-22T23:26:39Z","resolution_digest":null,"result_digest":"426039c7e1f5a88705c8059ce72c931a511082bdcf430066076479caf0c860c8","retention_digest":"400e2bb7b694d534517db1ff4407dad0e86b9d7c1b56bf7a7be2de09dafc9149","schema_version":1,"sha":"df33537d493052f8151f8b33e5e965f0ee3c5e02","status":"green"}
