{"cadence":"weekly","generation":106,"previous_digest":"8661246d27964baefa991f52c898e4331a9c7b238fc1e3376ffc2a84cad67f03","recorded_at":"2026-09-22T20:18:59Z","resolution_digest":null,"result_digest":"a26d4b5083a5733905ee315f83d93cfa0ec34340cb3837107aaa74bf8ff86bf3","retention_digest":"efd588cf472e8e99b0ac08a95a5a96220dd0b2c03ce44a57cf8a0d89813d7843","schema_version":1,"sha":"ef6b5db3d65d917c187ab5ffe1a234a316bc0893","status":"red"}
