{"cadence":"protected-main","generation":84,"previous_digest":"ca20ecd2e4fd12d7d74c5d91eeb4103998c7f5632a8c7a994a30a620d386a4d5","recorded_at":"2026-09-18T19:28:25Z","resolution_digest":null,"result_digest":"fe943225b0f51158ed76d2f64e7f224df763c21cd6ce72d0e171ae32ac9edb69","retention_digest":"c8ee2850690a054e91e0400930f780c10a08ec41c5b47b26c965cf77aca15f82","schema_version":1,"sha":"4a133ba88a4614c4fd81e93338cd3024549ff1a3","status":"green"}
